source,n_features,sample_features
credit_card_balance,31,"CC_MONTH_COUNT, CC_PREV_COUNT, CC_MONTHS_BALANCE_RECENT, CC_MONTHS_BALANCE_OLDEST, CC_ACTIVE_MONTH_COUNT, CC_COMPLETED_MONTH_COUNT, CC_ZERO_LIMIT_MONTH_COUNT, CC_UTILIZATION_GT_1_MONTH_COUNT, CC_NEGATIVE_BALANCE_MONTH_COUNT, CC_AMT_BALANCE_MEAN, CC_AMT_BALANCE_MAX, CC_AMT_BALANCE_SUM"
previous_application,26,"PREV_APP_COUNT, PREV_APPROVED_COUNT, PREV_REFUSED_COUNT, PREV_CANCELED_COUNT, PREV_UNUSED_OFFER_COUNT, PREV_ZERO_APPLICATION_COUNT, PREV_ZERO_CREDIT_COUNT, PREV_AMT_APPLICATION_SUM, PREV_AMT_APPLICATION_MEAN, PREV_AMT_APPLICATION_MAX, PREV_AMT_CREDIT_SUM, PREV_AMT_CREDIT_MEAN"
bureau,23,"BUREAU_LOAN_COUNT, BUREAU_ACTIVE_COUNT, BUREAU_CLOSED_COUNT, BUREAU_BAD_DEBT_COUNT, BUREAU_OVERDUE_LOAN_COUNT, BUREAU_CREDIT_DAY_OVERDUE_MAX, BUREAU_CREDIT_DAY_OVERDUE_MEAN, BUREAU_DAYS_CREDIT_RECENT, BUREAU_DAYS_CREDIT_OLDEST, BUREAU_ENDDATE_FUTURE_COUNT, BUREAU_AMT_CREDIT_SUM_SUM, BUREAU_AMT_CREDIT_SUM_MEAN"
POS_CASH_balance,20,"POS_MONTH_COUNT, POS_PREV_COUNT, POS_MONTHS_BALANCE_RECENT, POS_MONTHS_BALANCE_OLDEST, POS_ACTIVE_MONTH_COUNT, POS_COMPLETED_MONTH_COUNT, POS_DEMAND_MONTH_COUNT, POS_DPD_MONTH_COUNT, POS_DPD_DEF_MONTH_COUNT, POS_SK_DPD_MAX, POS_SK_DPD_MEAN, POS_SK_DPD_DEF_MAX"
installments_payments,18,"INST_PAYMENT_COUNT, INST_PREV_COUNT, INST_LATE_PAYMENT_COUNT, INST_UNDERPAYMENT_COUNT, INST_PAYMENT_MISSING_COUNT, INST_DAYS_LATE_POSITIVE_SUM, INST_DAYS_LATE_POSITIVE_MEAN, INST_DAYS_LATE_POSITIVE_MAX, INST_DAYS_EARLY_POSITIVE_MEAN, INST_AMT_INSTALMENT_SUM, INST_AMT_INSTALMENT_MEAN, INST_AMT_PAYMENT_SUM"
application_cleaned,15,"CODE_GENDER_UNKNOWN_FLAG, DAYS_EMPLOYED_ANOM_FLAG, APP_PROPERTY_MISSING_COUNT, APP_PROPERTY_MISSING_RATIO, APP_PROPERTY_ANY_MISSING_FLAG, APP_OWN_CAR_AGE_MISSING_FLAG, APP_AGE_YEARS, APP_EMPLOYED_YEARS, APP_REGISTRATION_YEARS, APP_ID_PUBLISH_YEARS, APP_CREDIT_INCOME_RATIO, APP_ANNUITY_INCOME_RATIO"
bureau_balance,8,"BB_MONTH_COUNT, BB_MONTHS_BALANCE_MIN, BB_MONTHS_BALANCE_MAX, BB_OVERDUE_MONTH_COUNT, BB_BAD_STATUS_MONTH_COUNT, BB_MAX_STATUS, BB_OVERDUE_MONTH_RATE, BB_BAD_STATUS_MONTH_RATE"
